DIVISION,TEAM_NAME,SCHEDULE_LINK
Girls U13 Division 3/4,Cincinnati United CU North 13G Elite 1,https://system.gotsport.com/org_event/events/43740/schedules?team=3223150
Girls U13 Division 3/4,Cincy SC Cincy SC G13 Orange,https://system.gotsport.com/org_event/events/43740/schedules?team=3223132
Girls U13 Division 3/4,Fairfield Optimist Soccer Club FOSC G13 Premier,https://system.gotsport.com/org_event/events/43740/schedules?team=3218665
Girls U13 Division 3/4,Cincinnati United CUSE 13G Arsenal,https://system.gotsport.com/org_event/events/43740/schedules?team=3224352
Girls U13 Division 5,Cincinnati Elite FC Cincinnati Elite FC G13 Gold,https://system.gotsport.com/org_event/events/43740/schedules?team=3219174
Girls U13 Division 5,Northwest Cincy Soccer Coalition Northwest Cincy SC G13 Phoenix,https://system.gotsport.com/org_event/events/43740/schedules?team=3230366
Girls U13 Division 5,Mercury Mercury G13 West 1,https://system.gotsport.com/org_event/events/43740/schedules?team=3218695
Girls U13 Division 5,Cincinnati West CWSC G13 United Red,https://system.gotsport.com/org_event/events/43740/schedules?team=3244008
Girls U13 Division 5,Kings Hammer Soccer Club KHA CINCY G13-A,https://system.gotsport.com/org_event/events/43740/schedules?team=3223918
Girls U13 Division 5,Ohio United FC Ohio United FC G13 Ignite,https://system.gotsport.com/org_event/events/43740/schedules?team=3225944
Girls U13 Division 6,Pleasant Ridge Football Club Pleasant Ridge Football Club G2013,https://system.gotsport.com/org_event/events/43740/schedules?team=3187811
Girls U13 Division 6,Lawrenceburg Greendale Soccer Club LGSC G13 Tiger Pride,https://system.gotsport.com/org_event/events/43740/schedules?team=3167601
Girls U13 Division 6,LSO United LSO United G13,https://system.gotsport.com/org_event/events/43740/schedules?team=3223129
Girls U13 Division 6,Campbell Soccer Club (CSC) CSC U13G Kremer,https://system.gotsport.com/org_event/events/43740/schedules?team=3213384
Girls U13 Division 6,FC Storm FC Storm G13 White,https://system.gotsport.com/org_event/events/43740/schedules?team=3162721
Girls U14 Division 1/2,STAR Rush Cincinnati STAR Rush G2012 Blue,https://system.gotsport.com/org_event/events/43740/schedules?team=3330198
Girls U14 Division 1/2,Clinton Massie SAY Premier Clinton Massie Premier G12,https://system.gotsport.com/org_event/events/43740/schedules?team=3061129
Girls U14 Division 1/2,Independence SC ISC G12 Cobras,https://system.gotsport.com/org_event/events/43740/schedules?team=3222955
Girls U14 Division 1/2,Mercury Mercury Premier 2012 Girls White,https://system.gotsport.com/org_event/events/43740/schedules?team=3224677
Girls U14 Division 1/2,Cincy SC Cincy SC G12 Navy,https://system.gotsport.com/org_event/events/43740/schedules?team=3223342
Girls U14 Division 1/2,Eclipse FC Eclipse East FC Blast White,https://system.gotsport.com/org_event/events/43740/schedules?team=3189881
Girls U14 Division 1/2,LSO United LSO United G12,https://system.gotsport.com/org_event/events/43740/schedules?team=3101520
Girls U14 Division 3,Eclipse FC Eclipse FC Thunder,https://system.gotsport.com/org_event/events/43740/schedules?team=3165226
Girls U14 Division 3,Kolping SC Kolping SC G12 Black,https://system.gotsport.com/org_event/events/43740/schedules?team=3217698
Girls U14 Division 3,Little Miami FC Little Miami FC 2012/2013 Girls,https://system.gotsport.com/org_event/events/43740/schedules?team=3200684
Girls U14 Division 3,Fusion FC NKY Fusion FC G12 White,https://system.gotsport.com/org_event/events/43740/schedules?team=3220481
Girls U14 Division 3,Cincinnati United CUSE 12G Barcelona,https://system.gotsport.com/org_event/events/43740/schedules?team=3224382
Girls U14 Division 3,Monroe Premier FC Monroe Premier FC 2012 Girls,https://system.gotsport.com/org_event/events/43740/schedules?team=3262556
Girls U14 Division 3,Inner Cincinnati SA Inner Cincinnati G14,https://system.gotsport.com/org_event/events/43740/schedules?team=3342001
Girls U14 Division 3,Franklin Youth Soccer Association Franklin Premier FC U14 Girls,https://system.gotsport.com/org_event/events/43740/schedules?team=3188274
Girls High School,Kolping SC Kolping SC HSA Black,https://system.gotsport.com/org_event/events/43740/schedules?team=3217756
Girls High School,Kolping SC Kolping SC HSA Orange,https://system.gotsport.com/org_event/events/43740/schedules?team=3217763
Girls High School,Campbell Soccer Club (CSC) CSC U16G Bush,https://system.gotsport.com/org_event/events/43740/schedules?team=3213414
Girls High School,Independence SC ISC Girls HS,https://system.gotsport.com/org_event/events/43740/schedules?team=3244751
Girls High School,Tempest FC Tempest Blue Devils,https://system.gotsport.com/org_event/events/43740/schedules?team=3482675
